{
  "$schema": "./schemas/corpus-manifest.schema.json",
  "format": "cognium-a11y-corpus-manifest",
  "format_version": "1.0.0",
  "corpus": {
    "id": "cogniumhq/a11y-benchmark",
    "default_branch": "master"
  },
  "generated": "2026-10-19",
  "counts": {
    "families": 14,
    "cases": 272
  },
  "digest_policy": "SHA-256 of parsed family JSON with the top-level generated field removed, serialized with JSON.stringify.",
  "families": [
    {
      "id": "core",
      "file": "catalog.json",
      "case_count": 44,
      "content_sha256": "sha256:754a48b398c520fa446740f37791d1305252a6ead498b368af1afee3e439f476"
    },
    {
      "id": "pipeline",
      "file": "pipeline.json",
      "case_count": 8,
      "content_sha256": "sha256:dc32911f39b9cf155a0cd4f6a1412d38a4fe4731e32a60f85c478f59a7fc3d4c"
    },
    {
      "id": "delivery",
      "file": "delivery.json",
      "case_count": 11,
      "content_sha256": "sha256:de7ec5de77ab65b92f45d7f82e978c8fcb42f09ef7f3bb1aaeb04eaf4f0334eb"
    },
    {
      "id": "patterns",
      "file": "patterns.json",
      "case_count": 32,
      "content_sha256": "sha256:20a25cebcda60dffc32115abb280b1c98eb5f0c3c4afcfc0a8500ef202c17ff8"
    },
    {
      "id": "journeys",
      "file": "journeys.json",
      "case_count": 18,
      "content_sha256": "sha256:ca681b3539922a1b76406d04a7d0be7e7dcd111388bf01ad95c27998a004837b"
    },
    {
      "id": "scenarios",
      "file": "scenarios.json",
      "case_count": 42,
      "content_sha256": "sha256:235a4433fb3f166a86922c22820e8e048e71a6289895fe46d6c377a75d3472f9"
    },
    {
      "id": "media",
      "file": "media.json",
      "case_count": 16,
      "content_sha256": "sha256:d3ba7ebdb95749648231c95abbe91cce18125071a60a15169d8363ec5e294b33"
    },
    {
      "id": "flash",
      "file": "flash.json",
      "case_count": 10,
      "content_sha256": "sha256:a0990f888f499151b2849f40f9382a47014cf176ba5c7ee132658092d4061482"
    },
    {
      "id": "color-independent",
      "file": "color-independent.json",
      "case_count": 16,
      "content_sha256": "sha256:d8af74b84f3d8e4986d199895150f89aa8733acb9cb71b3be2963bcc248856a5"
    },
    {
      "id": "ui-states",
      "file": "ui-states.json",
      "case_count": 20,
      "content_sha256": "sha256:b44c2f8afa454faefb9cd6a780771e7f4e352085c1001768b015fd429e29d91d"
    },
    {
      "id": "surfaces",
      "file": "surfaces.json",
      "case_count": 10,
      "content_sha256": "sha256:7b9f5d83ed0494fbf20d49ff6ac32d3faf4e1e8092741b4ff37ba1c9c1232119"
    },
    {
      "id": "guided",
      "file": "guided.json",
      "case_count": 15,
      "content_sha256": "sha256:4df6e4b185bace1fd2b8451bfb5bd5040ffee0878e50bc2a28bd1e369536a7d2"
    },
    {
      "id": "aaa",
      "file": "aaa.json",
      "case_count": 26,
      "content_sha256": "sha256:bb59900d22adcfad1774831b2063629e9afc1ee6a40041c9d10ff8395348046c"
    },
    {
      "id": "native",
      "file": "native.json",
      "case_count": 4,
      "content_sha256": "sha256:962e54ba3f4770d02b5d83d0e4d4e8341a723e0520176b99375bba3ee565b932"
    }
  ]
}
